event_id_cnty,event_date,year,time_precision,disorder_type,event_type,sub_event_type,actor1,assoc_actor_1,inter1,actor2,assoc_actor_2,inter2,interaction,civilian_targeting,iso,region,country,admin1,admin2,admin3,location,latitude,longitude,geo_precision,source,source_scale,notes,fatalities,tags,timestamp,population_1km,population_2km,population_5km,population_best
SRB3375,"22 November 2024",2024,1,Demonstrations,Protests,"Peaceful protest","Protesters (Serbia)",,Protesters,,,,"Protesters only",,688,Europe,Serbia,"South Banat",Pancevo,,Pancevo,44.8713,20.6443,1,Danas,Regional,"On 22 November 2024, citizen gathered in Pancevo to pause all their activities for 15 minutes as part of the 'Serbia, stop' campaign. This campaign, organized by members of the opposition took place in various cities across Serbia and called for everyone to pause their activities for 15 minutes to honor the 15 victims who lost their lives when the concrete canopy at the railway station in Novi Sad collapsed at 11:52. This is why the gatherings were taking place at this exact moment when the tragedy happened. The campaign aimed to show support for the families of victims, but also demand accountability from the authorities and those responsible for the tragic event.",0,"crowd size=no report",1732654792,6151,18214,71319,6151
SRB3376,"22 November 2024",2024,1,Demonstrations,Protests,"Peaceful protest","Protesters (Serbia)",,Protesters,,,,"Protesters only",,688,Europe,Serbia,Zlatibor,Pozega,,Pozega,43.8458,20.0367,1,Danas,Regional,"On 22 November 2024, citizen gathered in Pozega to pause all their activities for 15 minutes as part of the 'Serbia, stop' campaign. This campaign, organized by members of the opposition took place in various cities across Serbia and called for everyone to pause their activities for 15 minutes to honor the 15 victims who lost their lives when the concrete canopy at the railway station in Novi Sad collapsed at 11:52. This is why the gatherings were taking place at this exact moment when the tragedy happened. The campaign aimed to show support for the families of victims, but also demand accountability from the authorities and those responsible for the tragic event.",0,"crowd size=no report",1732654792,3575,9949,22711,3575
SRB3377,"22 November 2024",2024,1,Demonstrations,Protests,"Peaceful protest","Protesters (Serbia)",,Protesters,,,,"Protesters only",,688,Europe,Serbia,"West Backa",Sombor,,Sombor,45.7742,19.1151,1,"N1TV Online - Serbia",National,"On 22 November 2024, citizen gathered in Sombor to pause all their activities for 15 minutes as part of the 'Serbia, stop' campaign. This campaign, organized by members of the opposition took place in various cities across Serbia and called for everyone to pause their activities for 15 minutes to honor the 15 victims who lost their lives when the concrete canopy at the railway station in Novi Sad collapsed at 11:52. This is why the gatherings were taking place at this exact moment when the tragedy happened. The campaign aimed to show support for the families of victims, but also demand accountability from the authorities and those responsible for the tragic event.",0,"crowd size=no report",1732654792,1935,14190,42352,1935
SRB3378,"22 November 2024",2024,1,Demonstrations,Protests,"Peaceful protest","Protesters (Serbia)",,Protesters,,,,"Protesters only",,688,Europe,Serbia,Rasina,Trstenik,,Trstenik,43.6169,21.0025,1,Danas,Regional,"On 22 November 2024, citizen gathered in Trstenik to pause all their activities for 15 minutes as part of the 'Serbia, stop' campaign. This campaign, organized by members of the opposition took place in various cities across Serbia and called for everyone to pause their activities for 15 minutes to honor the 15 victims who lost their lives when the concrete canopy at the railway station in Novi Sad collapsed at 11:52. This is why the gatherings were taking place at this exact moment when the tragedy happened. The campaign aimed to show support for the families of victims, but also demand accountability from the authorities and those responsible for the tragic event.",0,"crowd size=no report",1732654792,4765,12287,19159,4765
SRB3379,"22 November 2024",2024,1,Demonstrations,Protests,"Peaceful protest","Protesters (Serbia)",,Protesters,,,,"Protesters only",,688,Europe,Serbia,Kolubara,Valjevo,,Valjevo,44.272,19.8874,1,"N1TV Online - Serbia",National,"On 22 November 2024, citizen gathered in Valjevo to pause all their activities for 15 minutes as part of the 'Serbia, stop' campaign. This campaign, organized by members of the opposition took place in various cities across Serbia and called for everyone to pause their activities for 15 minutes to honor the 15 victims who lost their lives when the concrete canopy at the railway station in Novi Sad collapsed at 11:52. This is why the gatherings were taking place at this exact moment when the tragedy happened. The campaign aimed to show support for the families of victims, but also demand accountability from the authorities and those responsible for the tragic event.",0,"crowd size=no report",1732654792,5855,23076,66513,5855
SRB3381,"22 November 2024",2024,1,Demonstrations,Protests,"Peaceful protest","Protesters (Serbia)",,Protesters,,,,"Protesters only",,688,Europe,Serbia,"South Banat",Vrsac,,Vrsac,45.1166,21.3036,1,"N1TV Online - Serbia",National,"On 22 November 2024, citizen gathered in Vrsac to pause all their activities for 15 minutes as part of the 'Serbia, stop' campaign. This campaign, organized by members of the opposition took place in various cities across Serbia and called for everyone to pause their activities for 15 minutes to honor the 15 victims who lost their lives when the concrete canopy at the railway station in Novi Sad collapsed at 11:52. This is why the gatherings were taking place at this exact moment when the tragedy happened. The campaign aimed to show support for the families of victims, but also demand accountability from the authorities and those responsible for the tragic event.",0,"crowd size=no report",1732654792,7270,26615,42824,7270
SRB3382,"22 November 2024",2024,1,Demonstrations,Protests,"Peaceful protest","Protesters (Serbia)","DS: Democratic Party; Government of Serbia (2017-); NPS: People's Movement of Serbia",Protesters,,,,"Protesters only",,688,Europe,Serbia,Zajecar,Zajecar,,Zajecar,43.9019,22.2755,1,"Danas; N1TV Online - Serbia",National-Regional,"On 22 November 2024, citizen, including an MP from DS and a local official from NPS, gathered in Zajecar to pause all their activities for 15 minutes as part of the 'Serbia, stop' campaign. This campaign, organized by members of the opposition took place in various cities across Serbia and called for everyone to pause their activities for 15 minutes to honor the 15 victims who lost their lives when the concrete canopy at the railway station in Novi Sad collapsed at 11:52. This is why the gatherings were taking place at this exact moment when the tragedy happened. The campaign aimed to show support for the families of victims, but also demand accountability from the authorities and those responsible for the tragic event.",0,"crowd size=no report",1732654792,9554,14020,32666,9554
SRB3383,"22 November 2024",2024,1,Demonstrations,Protests,"Peaceful protest","Protesters (Serbia)",,Protesters,,,,"Protesters only",,688,Europe,Serbia,"Central Banat",Zrenjanin,,Zrenjanin,45.3818,20.3954,1,"N1TV Online - Serbia",National,"On 22 November 2024, citizen gathered in Zrenjanin to pause all their activities for 15 minutes as part of the 'Serbia, stop' campaign. This campaign, organized by members of the opposition took place in various cities across Serbia and called for everyone to pause their activities for 15 minutes to honor the 15 victims who lost their lives when the concrete canopy at the railway station in Novi Sad collapsed at 11:52. This is why the gatherings were taking place at this exact moment when the tragedy happened. The campaign aimed to show support for the families of victims, but also demand accountability from the authorities and those responsible for the tragic event.",0,"crowd size=no report",1732654792,3896,22019,71949,3896
SRB3385,"22 November 2024",2024,1,Demonstrations,Protests,"Protest with intervention","Protesters (Serbia)",,Protesters,"Rioters (Serbia)",,Rioters,Rioters-Protesters,,688,Europe,Serbia,Macva,Loznica,,Loznica,44.5311,19.2426,1,Danas,Regional,"On 22 November 2024, citizens organized by the members of the opposition gathered in Loznica outside the City Assembly where they paused all their activities for 15 minutes as part of the 'Serbia, stop' campaign. This campaign which took place in various cities across Serbia called for everyone to pause their activities for 15 minutes to honor the 15 victims who lost their lives when the concrete canopy at the railway station in Novi Sad collapsed at 11:52. This is why the gatherings were taking place at this exact moment when the tragedy happened. The campaign aimed to show support for the families of victims, but also demand accountability from the authorities and those responsible for the tragic event. Following the 15-minute pause, a protest march took place in Loznica, during which an unknown individual exited a black jeep and punched one of the protesters.",0,"crowd size=no report",1732654792,1544,7821,25662,1544
SRB3384,"22 November 2024",2024,1,Demonstrations,Riots,"Violent demonstration","Rioters (Serbia)","Government of Serbia (2017-); Journalists (Serbia); SSP: Party of Freedom and Justice; Students (Serbia); Teachers (Serbia); SRCE: Serbia Centre",Rioters,"Rioters (Serbia)","Government of Serbia (2017-); SNS: Serbian Progressive Party",Rioters,Rioters-Rioters,,688,Europe,Serbia,Belgrade,,,Belgrade,44.6916,20.4261,2,"Danas; FoNet; Juzne Vesti; N1TV Online - Serbia",National-Regional,"On 22 November 2024, around 2500 citizens gathered at various locations in Belgrade - including Branko's bridge (along with representatives from the SSP and SRCE), in front of the Faculty of Dramatic Arts (FDU) in Novi Beograd, in front of the Faculty of Philology, in front of the Faculty of Law, in front of the Radio and Television of Serbia (RTS) on Takovska Street (several tens people along with the representatives of the initiative 'The Bridge Stays' ('Most ostaje')), at the intersection near the London neighborhood in Stari Grad, and at Student's Square (with the most massive gathering of around 1100 people). They paused all their activities for 15 minutes as part of the 'Serbia, Stop' campaign, which involved blocking traffic throughout the city. At two locations, the demonstration turned violent. In front of the Faculty of Dramatic Arts, where students and professors gathered in front of their faculty, several car drivers refused to stop and engaged in a fight with the demonstrators, during which a journalist from Nova.rs was also attacked while reporting on the event. The SSP political party later claimed that among those who attacked the students were two members of the local administration from the ruling SNS party. Another confrontation took place in front of the national television building, where a group of rioters clashed with demonstrators. An individual exited his car and violently tried to take umbrellas from the demonstrators, throwing away papers they were holding that bore the names of the victims from Novi Sad. In response, one demonstrator used pepper spray, leading to further violence as a group of rioters engaged in a fight with the demonstrators. The 'Serbia, Stop' campaign was organized by opposition members and took place in various cities across Serbia, calling for everyone to pause their activities for 15 minutes to honor the 15 victims who lost their lives when the concrete canopy at the railway station in Novi Sad collapsed at 11:52. The gatherings coincided with the exact moment of the tragedy. The campaign aimed to show support for the families of victims, but also demand accountability from the authorities and those responsible for the tragic event.",0,"crowd size=around 2500",1733253612,1777,13861,33117,13861
SRB3372,"22 November 2024",2024,1,Demonstrations,Protests,"Peaceful protest","Protesters (Serbia)","NPS: People's Movement of Serbia; SDP: Social Democratic Party of Serbia; Start-Change",Protesters,,,,"Protesters only",,688,Europe,Serbia,Nisava,Nis-Medijana,,Nis,43.3234,21.9018,1,"BETA; Danas; Juzne Vesti",Subnational-National,"On 22 November 2024, between 800 and 900 citizens (according to the Archive of public gatherings) along with representatives from the Start-Change movement, NPS, and SDP, gathered in Nis to pause all their activities for 15 minutes as part of the 'Serbia, stop' campaign. This campaign, organized by members of the opposition took place in various cities across Serbia and called for everyone to pause their activities for 15 minutes to honor the 15 victims who lost their lives when the concrete canopy at the railway station in Novi Sad collapsed at 11:52. This is why the gatherings were taking place at this exact moment when the tragedy happened. The campaign aimed to show support for the families of victims, but also demand accountability from the authorities and those responsible for the tragic event.",0,"crowd size=between 800 and 900",1733253612,5189,35833,135365,5189
SRB3373,"22 November 2024",2024,1,Demonstrations,Protests,"Peaceful protest","Protesters (Serbia)","Students (Serbia); Teachers (Serbia)",Protesters,,,,"Protesters only",,688,Europe,Serbia,"South Backa","Novi Sad",,"Novi Sad",45.2593,19.8291,2,"Juzne Vesti; N1TV Online - Serbia",National,"On 22 November 2024, between 900 and 1000 citizens, oppositional politicians, students and teachers gathered at several locations in Novi Sad, including at the suburban settlements of Veternik and Kisac, to pause all their activities for 15 minutes as part of the 'Serbia, stop' campaign. This campaign, organized by members of the opposition took place in various cities across Serbia and called for everyone to pause their activities for 15 minutes to honor the 15 victims who lost their lives when the concrete canopy at the railway station in Novi Sad collapsed at 11:52. This is why the gatherings were taking place at this exact moment when the tragedy happened. The campaign aimed to show support for the families of victims, but also demand accountability from the authorities and those responsible for the tragic event.",0,"crowd size=between 900 and 1000",1733253612,9541,41595,169916,9541
SRB3380,"22 November 2024",2024,1,Demonstrations,Protests,"Peaceful protest","Protesters (Serbia)",,Protesters,,,,"Protesters only",,688,Europe,Serbia,"South Backa",Vrbas,,Vrbas,45.5704,19.6478,1,"Juzne Vesti; N1TV Online - Serbia",National,"On 22 November 2024, around 80 citizens gathered in Vrbas to pause all their activities for 15 minutes as part of the 'Serbia, stop' campaign. This campaign, organized by members of the opposition took place in various cities across Serbia and called for everyone to pause their activities for 15 minutes to honor the 15 victims who lost their lives when the concrete canopy at the railway station in Novi Sad collapsed at 11:52. This is why the gatherings were taking place at this exact moment when the tragedy happened. The campaign aimed to show support for the families of victims, but also demand accountability from the authorities and those responsible for the tragic event.",0,"crowd size=around 80",1733253612,5946,11825,26444,5946
SRB3387,"22 November 2024",2024,1,Demonstrations,Protests,"Peaceful protest","Protesters (Serbia)",,Protesters,,,,"Protesters only",,688,Europe,Serbia,"West Backa",Apatin,,Apatin,45.6711,18.9847,1,"Juzne Vesti",National,"On 22 November 2024, citizens gathered in Apatin to pause all their activities for 15 minutes as part of the 'Serbia, stop' campaign. This campaign, organized by members of the opposition took place in various cities across Serbia and called for everyone to pause their activities for 15 minutes to honor the 15 victims who lost their lives when the concrete canopy at the railway station in Novi Sad collapsed at 11:52. This is why the gatherings were taking place at this exact moment when the tragedy happened. The campaign aimed to show support for the families of victims, but also demand accountability from the authorities and those responsible for the tragic event.",0,"crowd size=no report",1733261096,7613,14274,21753,7613
SRB3388,"22 November 2024",2024,1,Demonstrations,Protests,"Peaceful protest","Protesters (Serbia)",,Protesters,,,,"Protesters only",,688,Europe,Serbia,Sumadija,Arandelovac,,Arandelovac,44.3076,20.5611,1,"Juzne Vesti",National,"On 22 November 2024, citizens gathered in Arandelovac to pause all their activities for 15 minutes as part of the 'Serbia, stop' campaign. This campaign, organized by members of the opposition took place in various cities across Serbia and called for everyone to pause their activities for 15 minutes to honor the 15 victims who lost their lives when the concrete canopy at the railway station in Novi Sad collapsed at 11:52. This is why the gatherings were taking place at this exact moment when the tragedy happened. The campaign aimed to show support for the families of victims, but also demand accountability from the authorities and those responsible for the tragic event.",0,"crowd size=no report",1733261096,4011,10338,28501,4011
SRB3389,"22 November 2024",2024,1,Demonstrations,Protests,"Peaceful protest","Protesters (Serbia)",,Protesters,,,,"Protesters only",,688,Europe,Serbia,Zlatibor,Arilje,,Arilje,43.753,20.0955,1,"Juzne Vesti",National,"On 22 November 2024, citizens gathered in Arilje to pause all their activities for 15 minutes as part of the 'Serbia, stop' campaign. This campaign, organized by members of the opposition took place in various cities across Serbia and called for everyone to pause their activities for 15 minutes to honor the 15 victims who lost their lives when the concrete canopy at the railway station in Novi Sad collapsed at 11:52. This is why the gatherings were taking place at this exact moment when the tragedy happened. The campaign aimed to show support for the families of victims, but also demand accountability from the authorities and those responsible for the tragic event.",0,"crowd size=no report",1733261096,4509,9720,18907,4509
SRB3390,"22 November 2024",2024,1,Demonstrations,Protests,"Protest with intervention","Protesters (Serbia)","Civilians (Serbia); Journalists (Serbia)",Protesters,"Rioters (Serbia)",,Rioters,Rioters-Protesters,,688,Europe,Serbia,"South Backa",Becej,,Becej,45.6163,20.0333,1,"Juzne Vesti; Safe Journalists",National-Regional,"On 22 November 2024, citizens gathered in Becej to pause all their activities for 15 minutes as part of the 'Serbia, stop' campaign. The initiative aimed to demand accountability from the authorities while honoring the 15 victims of the Novi Sad tragedy, which occurred when a concrete canopy collapsed at the city's railway station. During the protest, a journalist who was reporting from the event was pushed away by several people who were trying to disrupt the protest.",0,"crowd size=no report",1733261096,1712,15783,27580,1712
SRB3392,"22 November 2024",2024,1,Demonstrations,Protests,"Peaceful protest","Protesters (Serbia)",,Protesters,,,,"Protesters only",,688,Europe,Serbia,Moravica,Cacak,,Cacak,43.888,20.344,1,"Juzne Vesti",National,"On 22 November 2024, citizens gathered in Cacak to pause all their activities for 15 minutes as part of the 'Serbia, stop' campaign. This campaign, organized by members of the opposition took place in various cities across Serbia and called for everyone to pause their activities for 15 minutes to honor the 15 victims who lost their lives when the concrete canopy at the railway station in Novi Sad collapsed at 11:52. This is why the gatherings were taking place at this exact moment when the tragedy happened. The campaign aimed to show support for the families of victims, but also demand accountability from the authorities and those responsible for the tragic event.",0,"crowd size=no report",1733261096,8996,19979,75184,8996
SRB3393,"22 November 2024",2024,1,Demonstrations,Protests,"Peaceful protest","Protesters (Serbia)",,Protesters,,,,"Protesters only",,688,Europe,Serbia,Pirot,Dimitrovgrad,,Dimitrovgrad,43.0192,22.7813,1,"Juzne Vesti",National,"On 22 November 2024, citizens gathered in Dimitrovgrad to pause all their activities for 15 minutes as part of the 'Serbia, stop' campaign. This campaign, organized by members of the opposition took place in various cities across Serbia and called for everyone to pause their activities for 15 minutes to honor the 15 victims who lost their lives when the concrete canopy at the railway station in Novi Sad collapsed at 11:52. This is why the gatherings were taking place at this exact moment when the tragedy happened. The campaign aimed to show support for the families of victims, but also demand accountability from the authorities and those responsible for the tragic event.",0,"crowd size=no report",1733261096,2084,3639,7221,2084
SRB3394,"22 November 2024",2024,1,Demonstrations,Protests,"Peaceful protest","Protesters (Serbia)",,Protesters,,,,"Protesters only",,688,Europe,Serbia,"South Backa",Zabalj,,Durdevo,45.3248,20.068,1,"Juzne Vesti",National,"On 22 November 2024, citizens gathered in Durdevo to pause all their activities for 15 minutes as part of the 'Serbia, stop' campaign. This campaign, organized by members of the opposition took place in various cities across Serbia and called for everyone to pause their activities for 15 minutes to honor the 15 victims who lost their lives when the concrete canopy at the railway station in Novi Sad collapsed at 11:52. This is why the gatherings were taking place at this exact moment when the tragedy happened. The campaign aimed to show support for the families of victims, but also demand accountability from the authorities and those responsible for the tragic event.",0,"crowd size=no report",1733261096,1607,3705,3846,1607
SRB3395,"22 November 2024",2024,1,Demonstrations,Protests,"Peaceful protest","Protesters (Serbia)",,Protesters,,,,"Protesters only",,688,Europe,Serbia,Moravica,"Gornji Milanovac",,"Gornji Milanovac",44.0245,20.4586,1,"Juzne Vesti",National,"On 22 November 2024, citizens gathered in Gornji Milanovac to pause all their activities for 15 minutes as part of the 'Serbia, stop' campaign. This campaign, organized by members of the opposition took place in various cities across Serbia and called for everyone to pause their activities for 15 minutes to honor the 15 victims who lost their lives when the concrete canopy at the railway station in Novi Sad collapsed at 11:52. This is why the gatherings were taking place at this exact moment when the tragedy happened. The campaign aimed to show support for the families of victims, but also demand accountability from the authorities and those responsible for the tragic event.",0,"crowd size=no report",1733261096,2625,17840,31303,2625
SRB3396,"22 November 2024",2024,1,Demonstrations,Protests,"Peaceful protest","Protesters (Serbia)",,Protesters,,,,"Protesters only",,688,Europe,Serbia,Moravica,Ivanjica,,Ivanjica,43.5802,20.2311,1,"Juzne Vesti",National,"On 22 November 2024, citizens gathered in Ivanjica to pause all their activities for 15 minutes as part of the 'Serbia, stop' campaign. This campaign, organized by members of the opposition took place in various cities across Serbia and called for everyone to pause their activities for 15 minutes to honor the 15 victims who lost their lives when the concrete canopy at the railway station in Novi Sad collapsed at 11:52. This is why the gatherings were taking place at this exact moment when the tragedy happened. The campaign aimed to show support for the families of victims, but also demand accountability from the authorities and those responsible for the tragic event.",0,"crowd size=no report",1733261096,5113,12492,22222,5113
SRB3397,"22 November 2024",2024,1,Demonstrations,Protests,"Peaceful protest","Protesters (Serbia)",,Protesters,,,,"Protesters only",,688,Europe,Serbia,Pomoravlje,Jagodina,,Jagodina,43.9791,21.2583,1,"Juzne Vesti",National,"On 22 November 2024, citizens gathered in Jagodina to pause all their activities for 15 minutes as part of the 'Serbia, stop' campaign. This campaign, organized by members of the opposition took place in various cities across Serbia and called for everyone to pause their activities for 15 minutes to honor the 15 victims who lost their lives when the concrete canopy at the railway station in Novi Sad collapsed at 11:52. This is why the gatherings were taking place at this exact moment when the tragedy happened. The campaign aimed to show support for the families of victims, but also demand accountability from the authorities and those responsible for the tragic event.",0,"crowd size=no report",1733261096,11651,17681,55268,11651
SRB3398,"22 November 2024",2024,1,Demonstrations,Protests,"Peaceful protest","Protesters (Serbia)",,Protesters,,,,"Protesters only",,688,Europe,Serbia,"North Banat",Kikinda,,Kikinda,45.8323,20.4682,1,"Juzne Vesti",National,"On 22 November 2024, citizens gathered in Kikinda to pause all their activities for 15 minutes as part of the 'Serbia, stop' campaign. This campaign, organized by members of the opposition took place in various cities across Serbia and called for everyone to pause their activities for 15 minutes to honor the 15 victims who lost their lives when the concrete canopy at the railway station in Novi Sad collapsed at 11:52. This is why the gatherings were taking place at this exact moment when the tragedy happened. The campaign aimed to show support for the families of victims, but also demand accountability from the authorities and those responsible for the tragic event.",0,"crowd size=no report",1733261096,2791,16701,34602,2791
