event_id_cnty,event_date,year,time_precision,disorder_type,event_type,sub_event_type,actor1,assoc_actor_1,inter1,actor2,assoc_actor_2,inter2,interaction,civilian_targeting,iso,region,country,admin1,admin2,admin3,location,latitude,longitude,geo_precision,source,source_scale,notes,fatalities,tags,timestamp,population_1km,population_2km,population_5km,population_best
SRB3980,"26 January 2025",2025,1,Demonstrations,Protests,"Peaceful protest","Protesters (Serbia)",,Protesters,,,,"Protesters only",,688,Europe,Serbia,"South Banat",Plandiste,,Plandiste,45.2297,21.1273,1,"N1TV Online - Serbia",National,"On 26 January 2025, citizens gathered in Plandiste in support of students who have been occupying their faculties nationwide, demanding accountability for the loss of 15 lives following the collapse of a concrete canopy at the train station in Novi Sad, ultimately blaming corruption for this tragic event.",0,"crowd size=no report",1738712872,1925,3210,3432,1925
SRB3981,"26 January 2025",2025,1,Demonstrations,Protests,"Peaceful protest","Protesters (Serbia)",,Protesters,,,,"Protesters only",,688,Europe,Serbia,Zlatibor,Sevojno,,Sevojno,43.85,19.9,1,"N1TV Online - Serbia",National,"On 26 January 2025, citizens held a protest in Sevojno in support of students who have been occupying their faculties nationwide, demanding accountability for the loss of 15 lives following the collapse of a concrete canopy at the train station in Novi Sad, ultimately blaming corruption for this tragic event.",0,"crowd size=no report",1738712872,839,4706,11604,839
SRB3982,"26 January 2025",2025,1,Demonstrations,Protests,"Peaceful protest","Protesters (Serbia)",,Protesters,,,,"Protesters only",,688,Europe,Serbia,Rasina,Varvarin,,Varvarin,43.7239,21.3624,1,"N1TV Online - Serbia",National,"On 26 January 2025, between 180 and 200 citizens (according to the Archive of Public Gatherings) gathered in Varvarin in support of students who have been occupying their faculties nationwide, demanding accountability for the loss of 15 lives following the collapse of a concrete canopy at the train station in Novi Sad, ultimately blaming corruption for this tragic event.",0,"crowd size=between 180 and 200",1738712872,1591,4347,7269,1591
SRB3983,"26 January 2025",2025,1,Demonstrations,Protests,"Peaceful protest","Protesters (Serbia)",,Protesters,,,,"Protesters only",,688,Europe,Serbia,Zajecar,Zajecar,,Zajecar,43.9019,22.2755,1,"N1TV Online - Serbia",National,"On 26 January 2025, citizens gathered in Zajecar in support of students who have been occupying their faculties nationwide, demanding accountability for the loss of 15 lives following the collapse of a concrete canopy at the train station in Novi Sad, ultimately blaming corruption for this tragic event.",0,"crowd size=no report",1738712872,9554,14020,32666,9554
SRB3874,"25 January 2025",2025,1,Demonstrations,Protests,"Protest with intervention","Protesters (Serbia)","Students (Serbia)",Protesters,"Rioters (Serbia)",,Rioters,Rioters-Protesters,,688,Europe,Serbia,Belgrade,,,Belgrade,44.6916,20.4261,2,"FoNet; N1TV Online - Serbia",National,"On 25 January 2025, citizens and students gathered at various locations in Belgrade as part of the 'Serbia, Stop' campaign. This movement has been taking place throughout the country since November 22, encouraging participants to pause their activities and block roads for 15 minutes to honor the 15 victims of the Novi Sad tragedy and demand accountability for their loss of life. An unidentified individual arrived carrying a knife and tearing down student protest banners displayed on the building of the Faculty of Law. Students confronted the individual, after which he left the scene. No physical altercations or injuries were reported.",0,"crowd size=no report",1738712872,1777,13861,33117,1777
SRB3875,"25 January 2025",2025,1,Demonstrations,Protests,"Peaceful protest","Protesters (Serbia)","Civilians (Serbia); Farmers (Serbia); Government of Serbia (2017-); Journalists (Serbia); SSP: Party of Freedom and Justice; Students (Serbia)",Protesters,,,,"Protesters only",,688,Europe,Serbia,"South Backa","Novi Sad",,Rumenka,45.2932,19.7438,2,"N1TV Online - Serbia; RFE/RL",National-International,"On 25 January 2025, farmers began a protest ride to Novi Sad to support the students who were occupying their faculties, demanding accountability for the loss of 15 lives following the collapse of a concrete canopy at the train station in Novi Sad, ultimately blaming corruption for this tragic event. However, they were blocked by police officers at a bridge near Rumenka. Students and opposition members, including a representative from the SSP and an MP, joined the farmers in protesting against this blockade. The police then began to push the protesters and journalists from the N1 TV station away from the bridge. Despite the obstruction, the farmers found alternative routes and successfully arrived in Novi Sad. Once there, they parked their tractors in front of the University campus and observed 15 minutes of silence as part of the 'Serbia, Stop' campaign to honor the victims and advocate for students' demands (coded separately). Farmers said they plan to stay parked there until February 1 when they aim to join students in a protest marking the three-month anniversary of the tragedy at Novi Sad's train station.",0,"crowd size=no report",1738712872,4769,8228,12504,4769
SRB3892,"25 January 2025",2025,1,Demonstrations,Protests,"Peaceful protest","Protesters (Serbia)","Students (Serbia)",Protesters,,,,"Protesters only",,688,Europe,Serbia,Nisava,Aleksinac,,Aleksinac,43.5416,21.7077,1,"N1TV Online - Serbia",National,"On 25 January 2025, over 1,200 citizens, including more than 100 students, gathered in Aleksinac in support of students who have been occupying their faculties nationwide. The protesters demanded accountability for the deaths of 15 people following the collapse of a concrete canopy at the Novi Sad train station, blaming corruption for the tragedy. As part of the 'Serbia, Stop' campaign, the demonstrators observed 15 minutes of silence to honor the victims and advocate for their demands.",0,"crowd size=over 1,200",1738712872,2053,10675,18015,2053
SRB3893,"25 January 2025",2025,1,Demonstrations,Protests,"Peaceful protest","Protesters (Serbia)","Students (Serbia)",Protesters,,,,"Protesters only",,688,Europe,Serbia,Belgrade,Mladenovac,,Mladenovac,44.4363,20.6918,1,"N1TV Online - Serbia",National,"On 25 January 2025, 2,200 students and citizens (according to the Archive of Public Gatherings) protested in Mladenovac, where they blocked Kralja Petra Prvog Street as part of the nationwide student protest demanding accountability for the Novi Sad tragedy in which 15 people lost their lives following the collapse of a concrete canopy at the city's train station. As part of the 'Serbia, Stop' campaign, the protesters observed 15 minutes of silence to honor the victims and advocate for their demands.",0,"crowd size=2,200",1738712872,9043,12869,34984,9043
SRB3894,"25 January 2025",2025,1,Demonstrations,Protests,"Peaceful protest","Protesters (Serbia)","Students (Serbia)",Protesters,,,,"Protesters only",,688,Europe,Serbia,"South Banat",Pancevo,,Pancevo,44.8713,20.6443,1,"N1TV Online - Serbia",National,"On 25 January 2025, 5,500 students and citizens (according to the Archive of Public Gatherings) gathered in Pancevo to support students who have been occupying their faculties nationwide. The protesters demanded accountability for the deaths of 15 people following the collapse of a concrete canopy at the Novi Sad train station, blaming corruption for the tragedy. As part of the 'Serbia, Stop' campaign, the protesters observed 15 minutes of silence to honor the victims and advocate for their demands.",0,"crowd size=5,500",1738712872,6151,18214,71319,6151
SRB3895,"25 January 2025",2025,1,Demonstrations,Protests,"Peaceful protest","Protesters (Serbia)","Students (Serbia)",Protesters,,,,"Protesters only",,688,Europe,Serbia,Pirot,Pirot,,Pirot,43.1617,22.5871,1,"N1TV Online - Serbia",National,"On 25 January 2025, several thousand citizens and students protested in Pirot to support students who have been occupying their faculties nationwide. The protesters demanded accountability for the deaths of 15 people following the collapse of a concrete canopy at the Novi Sad train station, blaming corruption for the tragedy. As part of the 'Serbia, Stop' campaign, the protesters observed 15 minutes of silence to honor the victims and advocate for their demands.",0,"crowd size=several thousand",1738712872,5960,18315,50198,5960
SRB3896,"25 January 2025",2025,1,Demonstrations,Protests,"Peaceful protest","Protesters (Serbia)","Students (Serbia)",Protesters,,,,"Protesters only",,688,Europe,Serbia,"Central Banat",Zrenjanin,,Zrenjanin,45.3818,20.3954,1,"N1TV Online - Serbia",National,"On 25 January 2025, 3,600 students and citizens (according to the Archive of Public Gatherings) gathered in Zrenjanin to support students who have been occupying their faculties nationwide. The protesters demanded accountability for the deaths of 15 people following the collapse of a concrete canopy at the Novi Sad train station, blaming corruption for the tragedy. As part of the 'Serbia, Stop' campaign, the protesters observed 15 minutes of silence to honor the victims and advocate for their demands.",0,"crowd size=3,600",1738712872,3896,22019,71949,3896
SRB3924,"25 January 2025",2025,1,Demonstrations,Protests,"Peaceful protest","Protesters (Serbia)","Farmers (Serbia); Students (Serbia)",Protesters,,,,"Protesters only",,688,Europe,Serbia,"South Backa","Novi Sad",,"Novi Sad",45.2593,19.8291,1,"N1TV Online - Serbia; RFE/RL",National-International,"On 25 January 2025, students, farmers and citizens gathered in Novi Sad to observe 15 minutes of silence as part of the 'Serbia, Stop' campaign, to honor the victims who lost their lives following the collapse of a concrete canopy at the Novi Sad train station and demand accountability for their deaths. On the same day, farmers parked their tractors in front of the Novi Sad's University campus, after initially being blocked near Rumenka by police, with an aim to join students in a protest marking the three-month anniversary of the tragedy at Novi Sad's train station.",0,"crowd size=no report",1738712872,9541,41595,169916,9541
SRB3934,"25 January 2025",2025,1,"Strategic developments","Strategic developments","Looting/property destruction","Unidentified Armed Group (Serbia)",,"Political militia","Civilians (Serbia)","Students (Serbia)",Civilians,"Political militia-Civilians",,688,Europe,Serbia,Nisava,Nis-Medijana,,Nis,43.3234,21.9018,1,"N1TV Online - Serbia; RFE/RL",National-International,"Property destruction: On 25 January 2025, a group of at least 20 masked individuals attacked the Faculty of Sport and the Faculty of Occupational Safety in Nis by throwing stones at the buildings. They quickly fled the scene. Students who have occupied these faculties, demanding accountability for the deaths of 15 people caused by the collapse of a concrete canopy at the Novi Sad train station were located inside of these faculties when the attack happened.",0,,1738712872,5189,35833,135365,
SRB3935,"25 January 2025",2025,1,Demonstrations,Protests,"Peaceful protest","Protesters (Serbia)","Students (Serbia); Teachers (Serbia)",Protesters,,,,"Protesters only",,688,Europe,Serbia,Toplica,Kursumlija,,Raca,43.0079,21.321,1,"N1TV Online - Serbia",National,"On 25 January 2025, citizens, students, and education workers gathered in Raca, in front of the Municipal Building, to show support for student protests and striking education workers while demanding accountability for the deaths of 15 people following the collapse of a concrete canopy at the Novi Sad train station, blaming corruption for the tragedy. Protesters also honored victims as part of the 'Serbia, Stop' campaign, including victims of a fire in a nursing home in Barajevo.",0,"crowd size=no report",1738712872,48,223,315,48
SRB3953,"25 January 2025",2025,1,Demonstrations,Protests,"Peaceful protest","Protesters (Serbia)",,Protesters,,,,"Protesters only",,688,Europe,Serbia,Sumadija,Arandelovac,,Arandelovac,44.3076,20.5611,1,"N1TV Online - Serbia",National,"On 25 January 2025, citizens protested in Arandelovac on Trg slobode (Freedom Square) to support students who have been occupying their faculties nationwide. The protesters demanded accountability for the deaths of 15 people following the collapse of a concrete canopy at the Novi Sad train station, blaming corruption for the tragedy. As part of the 'Serbia, Stop' campaign, the protesters observed 15 minutes of silence to honor the victims and advocate for their demands.",0,"crowd size=no report",1738712872,4011,10338,28501,4011
SRB3954,"25 January 2025",2025,1,Demonstrations,Protests,"Peaceful protest","Protesters (Serbia)",,Protesters,,,,"Protesters only",,688,Europe,Serbia,Moravica,"Gornji Milanovac",,"Gornji Milanovac",44.0245,20.4586,1,"N1TV Online - Serbia",National,"On 25 January 2025, citizens gathered in Gornji Milanovac to support students who have been occupying their faculties nationwide. The protesters demanded accountability for the deaths of 15 people following the collapse of a concrete canopy at the Novi Sad train station, blaming corruption for the tragedy.",0,"crowd size=no report",1738712872,2625,17840,31303,2625
SRB3955,"25 January 2025",2025,1,Demonstrations,Protests,"Peaceful protest","Protesters (Serbia)",,Protesters,,,,"Protesters only",,688,Europe,Serbia,"North Banat",Kikinda,,Kikinda,45.8323,20.4682,1,"N1TV Online - Serbia",National,"On 25 January 2025, citizens gathered in Kikinda to support students who have been occupying their faculties nationwide. The protesters demanded accountability for the deaths of 15 people following the collapse of a concrete canopy at the Novi Sad train station, blaming corruption for the tragedy.",0,"crowd size=no report",1738712872,2791,16701,34602,2791
SRB3956,"25 January 2025",2025,1,Demonstrations,Protests,"Peaceful protest","Protesters (Serbia)",,Protesters,,,,"Protesters only",,688,Europe,Serbia,Zlatibor,Prijepolje,,Prijepolje,43.3903,19.6506,1,"N1TV Online - Serbia",National,"On 25 January 2025, citizens gathered in Prijepolje to support students who have been occupying their faculties nationwide. The protesters demanded accountability for the deaths of 15 people following the collapse of a concrete canopy at the Novi Sad train station, blaming corruption for the tragedy.",0,"crowd size=no report",1738712872,3208,10215,16886,3208
SRB3957,"25 January 2025",2025,1,Demonstrations,Protests,"Peaceful protest","Protesters (Serbia)",,Protesters,,,,"Protesters only",,688,Europe,Serbia,Podunavlje,Smederevo,,Smederevo,44.6516,20.9258,1,"N1TV Online - Serbia",National,"On 25 January 2025, citizens gathered in Smederevo to support student-led protests demanding accountability for the deaths of 15 people following the collapse of a concrete canopy at the Novi Sad train station, blaming corruption for the tragedy.",0,"crowd size=no report",1738712872,6703,18856,53971,6703
SRB3958,"25 January 2025",2025,1,Demonstrations,Protests,"Peaceful protest","Protesters (Serbia)",,Protesters,,,,"Protesters only",,688,Europe,Serbia,"West Backa",Sombor,,Sombor,45.7742,19.1151,1,"N1TV Online - Serbia",National,"On 25 January 2025, citizens gathered in Sombor to support students who have been occupying their faculties nationwide. The protesters demanded accountability for the deaths of 15 people following the collapse of a concrete canopy at the Novi Sad train station, blaming corruption for the tragedy.",0,"crowd size=no report",1738712872,1935,14190,42352,1935
SRB3960,"25 January 2025",2025,1,Demonstrations,Protests,"Peaceful protest","Protesters (Serbia)",,Protesters,,,,"Protesters only",,688,Europe,Serbia,Pomoravlje,Svilajnac,,Svilajnac,44.2337,21.1967,1,"N1TV Online - Serbia",National,"On 25 January 2025, 500 citizens (according to the Archive of Public Gatherings) gathered in Svilajnac to support students who have been occupying their faculties nationwide. The protesters demanded accountability for the deaths of 15 people following the collapse of a concrete canopy at the Novi Sad train station, blaming corruption for the tragedy.",0,"crowd size=500",1738712872,2005,8406,13077,2005
SRB3961,"25 January 2025",2025,1,Demonstrations,Protests,"Peaceful protest","Protesters (Serbia)",,Protesters,,,,"Protesters only",,688,Europe,Serbia,Nisava,Svrljig,,Svrljig,43.4133,22.1211,1,"Juzne Vesti",Subnational,"On 25 January 2025, citizens gathered in Svrljig in support of students who have been occupying their faculties nationwide. The protesters demanded accountability for the deaths of 15 people following the collapse of a concrete canopy at the Novi Sad train station, blaming corruption for the tragedy.",0,"crowd size=no report",1738712872,5811,7684,10702,5811
SRB3962,"25 January 2025",2025,1,Demonstrations,Protests,"Peaceful protest","Protesters (Serbia)",,Protesters,,,,"Protesters only",,688,Europe,Serbia,Podunavlje,"Velika Plana",,"Velika Plana",44.3338,21.0767,1,"N1TV Online - Serbia",National,"On 25 January 2025, citizens gathered in Velika Plana to support students who have been occupying their faculties nationwide. The protesters demanded accountability for the deaths of 15 people following the collapse of a concrete canopy at the Novi Sad train station, blaming corruption for the tragedy.",0,"crowd size=no report",1738712872,1805,8159,15798,1805
SRB3963,"25 January 2025",2025,1,Demonstrations,Protests,"Peaceful protest","Protesters (Serbia)",,Protesters,,,,"Protesters only",,688,Europe,Serbia,"South Banat",Vrsac,,Vrsac,45.1166,21.3036,1,"N1TV Online - Serbia",National,"On 25 January 2025, citizens gathered in Vrsac to support students who have been occupying their faculties nationwide. The protesters demanded accountability for the deaths of 15 people following the collapse of a concrete canopy at the Novi Sad train station, blaming corruption for the tragedy.",0,"crowd size=no report",1738712872,7270,26615,42824,7270
SRB3964,"25 January 2025",2025,1,Demonstrations,Protests,"Peaceful protest","Protesters (Serbia)",,Protesters,,,,"Protesters only",,688,Europe,Serbia,"Central Banat",Zitiste,,Zitiste,45.4854,20.5533,1,"N1TV Online - Serbia",National,"On 25 January 2025, 140 citizens (according to the Archive of Public Gatherings) gathered in Zitiste to support students who have been occupying their faculties nationwide. The protesters demanded accountability for the deaths of 15 people following the collapse of a concrete canopy at the Novi Sad train station, blaming corruption for the tragedy.",0,"crowd size=140",1738712872,958,1360,1929,958
SRB3745,"24 January 2025",2025,1,"Political violence; Demonstrations",Protests,"Excessive force against protesters","Protesters (Serbia)","Students (Serbia)",Protesters,"Rioters (Serbia)",,Rioters,Rioters-Protesters,"Civilian targeting",688,Europe,Serbia,Belgrade,"Novi Beograd",,"Belgrade - Novi Beograd",44.808,20.3874,1,"N1TV Online - Serbia",National,"On 24 January 2025, a car driver struck two students on Jurija Gagarina Street in Belgrade - Novi Beograd during a protest in which citizens had gathered to advocate for a general strike until the demands of students occupying faculties nationwide were met. One of the students sustained a serious head injury and had to be urgently transported to the hospital, while the perpetrator was arrested shortly after the incident.",0,"crowd size=no report",1738102180,18770,53798,189602,18770
SRB3748,"24 January 2025",2025,1,"Political violence",Riots,"Mob violence","Rioters (Serbia)","Police Forces of Serbia (2017-); Private Security Forces (Serbia)",Rioters,"Civilians (Serbia)","Journalists (Serbia)",Civilians,Rioters-Civilians,"Civilian targeting",688,Europe,Serbia,Kolubara,Valjevo,,Valjevo,44.272,19.8874,1,"N1TV Online - Serbia",National,"On 24 January 2025, security personnel and police officers attempted to prevent members of the opposition and journalists from entering the municipal building in Valjevo by pushing them away from the doors. After the opposition members successfully entered the building, they displayed banners in the hall with the messages 'Corruption kills' and 'General strike'.",0,"crowd size=no report",1738102180,5855,23076,66513,23076
SRB3762,"24 January 2025",2025,1,Demonstrations,Protests,"Peaceful protest","Protesters (Serbia)","Lawyers (Serbia)",Protesters,,,,"Protesters only",,688,Europe,Serbia,Belgrade,"Stari Grad",,"Belgrade - Stari Grad",44.823,20.4605,1,"N1TV Online - Serbia",National,"On 24 January 2025, lawyers gathered in front of the Presidency building in Belgrade - Stari Grad to protest against the President's insulting statement, in which he referred to them as 'a mob' in reaction to their strike. Activists from the initiative 'The Bridge Stays' ('Most ostaje') also gathered in front of the Presidency building, where they displayed a banner depicting a bloody middle finger which they managed to take off from one of the overpasses in Belgrade. These banners had appeared in various forms over the last few days throughout the country, including in schoolyards, city streets, major roads, and overpasses, and intended to mock the symbol of the nation-wide protests (picturing bloody hand). The activists explained that they aimed to return the banner to its original creator.",0,"crowd size=no report",1738102180,9651,38334,101955,9651
SRB3766,"24 January 2025",2025,1,Demonstrations,Protests,"Peaceful protest","Protesters (Serbia)","NDSS: New Democratic Party of Serbia; POKS: Movement to Restore the Kingdom of Serbia",Protesters,,,,"Protesters only",,688,Europe,Serbia,Belgrade,Vozdovac,,"Belgrade - Vozdovac",44.7761,20.4776,1,Danas,Regional,"On 24 January 2025, the oppositional coalition NADA, consisting of the NDSS and POKS blocked the highway at the exit for Vrcin near Bubanj Potok in Belgrade - Vozdovac to show their support for a nationwide strike called by students occupying faculties across the country. This strike was a form of protest aimed at having their demands met, including demands for accountability for the 15 deaths caused by an infrastructure collapse at the Novi Sad railway station in November, as well as an end to the prosecutions of individuals arrested during previous protests and criminal charges against individuals who attacked students during these protests.",0,"crowd size=no report",1738102180,12440,39346,96229,12440
SRB3773,"24 January 2025",2025,1,"Strategic developments","Strategic developments",Other,"Protesters (Serbia)","Health Workers (Serbia); Journalists (Serbia); Labor Group (Serbia); Teachers (Serbia)",Protesters,,,,"Protesters only",,688,Europe,Serbia,Belgrade,,,Belgrade,44.6916,20.4261,3,"N1TV Online - Serbia",National,"Other: On 24 January 2025, a nationwide strike took place, called by students occupying faculties across the country (coded to Belgrade). The strike saw participation from teachers, health workers, private companies, restaurants, actors, artists, libraries, journalists, and many other businesses. It served as a protest to address various student demands, including accountability for the 15 deaths resulting from an infrastructure collapse at the Novi Sad railway station in November. Additionally, the students called for an end to the prosecutions of individuals arrested during previous protests and the criminal charges against those who attacked students during these demonstrations. Currently, there is no precise data available on the percentage of people who joined the general strike.",0,,1738102180,1777,13861,33117,
SRB3793,"24 January 2025",2025,1,Demonstrations,Protests,"Peaceful protest","Protesters (Serbia)","Students (Serbia)",Protesters,,,,"Protesters only",,688,Europe,Serbia,Nisava,Aleksinac,,Aleksinac,43.5416,21.7077,1,"N1TV Online - Serbia",National,"On 24 January 2025, around 800 citizens and students gathered in Aleksinac to show their support for a nationwide strike called by students occupying faculties across the country. This strike was a form of protest aimed at having their demands met, including demands for accountability for the 15 deaths caused by an infrastructure collapse at the Novi Sad railway station in November, as well as an end to the prosecutions of individuals arrested during previous protests and criminal charges against individuals who attacked students during these protests.",0,"crowd size=around 800",1738102180,2053,10675,18015,2053
SRB3794,"24 January 2025",2025,1,Demonstrations,Protests,"Peaceful protest","Protesters (Serbia)","Students (Serbia)",Protesters,,,,"Protesters only",,688,Europe,Serbia,Moravica,Cacak,,Cacak,43.888,20.344,1,"N1TV Online - Serbia",National,"On 24 January 2025, citizens and students gathered in Cacak to show their support for a nationwide strike called by students occupying faculties across the country. This strike was a form of protest aimed at having their demands met, including demands for accountability for the 15 deaths caused by an infrastructure collapse at the Novi Sad railway station in November, as well as an end to the prosecutions of individuals arrested during previous protests and criminal charges against individuals who attacked students during these protests. Protesters also observed 15 minutes of silence as part of the 'Serbia, Stop' campaign, with an aim to honor the 15 victims and demand accountability for their loss of life.",0,"crowd size=no report",1738102180,8996,19979,75184,8996
