event_id_cnty,event_date,year,time_precision,disorder_type,event_type,sub_event_type,actor1,assoc_actor_1,inter1,actor2,assoc_actor_2,inter2,interaction,civilian_targeting,iso,region,country,admin1,admin2,admin3,location,latitude,longitude,geo_precision,source,source_scale,notes,fatalities,tags,timestamp,population_1km,population_2km,population_5km,population_best
SRB3543,"08 January 2025",2025,1,Demonstrations,Protests,"Peaceful protest","Protesters (Serbia)","Students (Serbia); Teachers (Serbia)",Protesters,,,,"Protesters only",,688,Europe,Serbia,Belgrade,"Stari Grad",,"Belgrade - Stari Grad",44.823,20.4605,1,"N1TV Online - Serbia",National,"On 8 January 2025, teachers, students and parents protested in front of the Aviation Academy in Belgrade - Stari Grad against the replacement of the current director with a new one allegedly affiliated with the governing political party. The protesters voiced their concerns about the safety of the school and its students.",0,"crowd size=no report",1737435626,9651,38334,101955,9651
SRB3544,"08 January 2025",2025,1,Demonstrations,Protests,"Peaceful protest","Protesters (Serbia)","Students (Serbia)",Protesters,,,,"Protesters only",,688,Europe,Serbia,Belgrade,Vracar,,"Belgrade - Vracar",44.7981,20.4772,1,"N1TV Online - Serbia",National,"On 8 January 2025, students and citizens gathered in front of the Electrotechnical Faculty in Belgrade - Vracar as part of the 'Serbia, Stop' campaign. This movement has been taking place throughout the country since November 22, encouraging participants to pause their activities and block roads for 15 minutes to honor the 15 victims of the Novi Sad tragedy and demand accountability for their loss of life. This time, the protesters observed 16 minutes of silence to also honor a person who was recently killed in Indjija.",0,"crowd size=no report",1737435626,9003,35358,61808,9003
SRB3545,"08 January 2025",2025,1,Demonstrations,Protests,"Peaceful protest","Protesters (Serbia)","Farmers (Serbia)",Protesters,,,,"Protesters only",,688,Europe,Serbia,Macva,Bogatic,,Bogatic,44.8375,19.4805,1,"N1TV Online - Serbia",National,"On 8 January 2025, dairy farmers protested in Bogatic against the announced decrease in milk prices due to massive imports and low prices for livestock.",0,"crowd size=no report",1737435626,1784,3208,5780,1784
SRB3548,"08 January 2025",2025,1,Demonstrations,Protests,"Peaceful protest","Protesters (Serbia)","Students (Serbia)",Protesters,,,,"Protesters only",,688,Europe,Serbia,"South Backa","Novi Sad",,"Novi Sad",45.2593,19.8291,1,"N1TV Online - Serbia",National,"On 8 January 2025, university and high school students, along with citizens, protested in front of the court in Novi Sad after the Minister of Construction, Transportation, and Infrastructure of Serbia failed to appear for the second time for his hearing, nor he was taken into custody. He had been indicted in connection with the collapse of the concrete canopy at Novi Sad's train station, which resulted in the deaths of 15 people.",0,"crowd size=no report",1737435626,9541,41595,169916,9541
SRB3547,"08 January 2025",2025,1,Demonstrations,Protests,"Peaceful protest","Protesters (Serbia)",,Protesters,,,,"Protesters only",,688,Europe,Serbia,Rasina,Krusevac,,Krusevac,43.5811,21.3352,1,"Danas; N1TV Online - Serbia",National-Regional,"On 8 January 2025, between several tens and 400 citizens (according to different sources) gathered in Krusevac as part of the 'Serbia, Stop' campaign to show their support for students who have been occupying their faculties nationwide, demanding accountability for the loss of 15 lives following the collapse of a concrete canopy at the train station in Novi Sad, ultimately blaming corruption for this tragic event.",0,"crowd size=between several tens and 400",1737488030,4489,22859,74419,4489
SRB3549,"08 January 2025",2025,1,Demonstrations,Protests,"Peaceful protest","Protesters (Serbia)",,Protesters,,,,"Protesters only",,688,Europe,Serbia,Rasina,Trstenik,,Trstenik,43.6169,21.0025,1,"N1TV Online - Serbia",National,"On 8 January 2025, around 300 citizens (according to the Archive of Public Gatherings) protested in Trstenik as part of the 'Serbia, Stop' campaign. This movement has been taking place throughout the country since November 22, encouraging participants to pause their activities and block roads for 15 minutes to honor the 15 victims of the Novi Sad tragedy and demand accountability for their loss of life.",0,"crowd size=around 300",1737488030,4765,12287,19159,4765
SRB3728,"08 January 2025",2025,2,Demonstrations,Protests,"Peaceful protest","Protesters (Serbia)",,Protesters,,,,"Protesters only",,688,Europe,Serbia,Zajecar,Sokobanja,,Sokobanja,43.6433,21.8711,1,"N1TV Online - Serbia",National,"Around 8 January 2025 (week of), 150 citizens (according to the Archive of Public Gatherings) protested in Sokobanja as part of the 'Serbia, Stop' campaign. This movement has been taking place throughout the country since November 22, encouraging participants to pause their activities and block roads for 15 minutes to honor the 15 victims of the Novi Sad tragedy and demand accountability for their loss of life.",0,"crowd size=150",1737495320,1636,5914,10671,1636
SRB3729,"08 January 2025",2025,2,Demonstrations,Protests,"Peaceful protest","Protesters (Serbia)",,Protesters,,,,"Protesters only",,688,Europe,Serbia,Zlatibor,Uzice,,Uzice,43.8582,19.8441,1,"N1TV Online - Serbia",National,"Around 8 January 2025 (week of), 1000 citizens (according to the Archive of Public Gatherings) protested in Uzice as part of the 'Serbia, Stop' campaign. This movement has been taking place throughout the country since November 22, encouraging participants to pause their activities and block roads for 15 minutes to honor the 15 victims of the Novi Sad tragedy and demand accountability for their loss of life.",0,"crowd size=1000",1737495320,6850,22818,39695,6850
SRB3730,"08 January 2025",2025,2,Demonstrations,Protests,"Peaceful protest","Protesters (Serbia)",,Protesters,,,,"Protesters only",,688,Europe,Serbia,Kolubara,Valjevo,,Valjevo,44.272,19.8874,1,"N1TV Online - Serbia",National,"Around 8 January 2025 (week of), 600 citizens (according to the Archive of Public Gatherings) protested in Valjevo as part of the 'Serbia, Stop' campaign. This movement has been taking place throughout the country since November 22, encouraging participants to pause their activities and block roads for 15 minutes to honor the 15 victims of the Novi Sad tragedy and demand accountability for their loss of life.",0,"crowd size=600",1737495320,5855,23076,66513,5855
SRB3546,"08 January 2025",2025,1,Demonstrations,Protests,"Peaceful protest","Protesters (Serbia)",,Protesters,,,,"Protesters only",,688,Europe,Serbia,Raska,Kraljevo,,Kraljevo,43.7259,20.6896,1,"N1TV Online - Serbia",National,"On 8 January 2025, 900 citizens (according to the Archive of Public Gatherings) protested in Kraljevo to show their support for students who have been occupying their faculties nationwide, demanding accountability for the loss of 15 lives following the collapse of a concrete canopy at the train station in Novi Sad, ultimately blaming corruption for this tragic event. The protesters began by observing 15 minutes of silence as part of the 'Serbia, Stop' campaign, with an aim to honor the 15 victims and voice their demands.",0,"crowd size=no report",1738712872,5532,21674,46623,5532
SRB3534,"06 January 2025",2025,1,"Political violence",Riots,"Mob violence","Rioters (Serbia)","Government of Serbia (2017-); SNS: Serbian Progressive Party",Rioters,"Police Forces of Serbia (2017-)",,"State forces","State forces-Rioters",,688,Europe,Serbia,"South Backa",Titel,,Sajkas,45.2708,20.0963,1,Danas,Regional,"On 6 January 2025, a municipal official and a member of the ruling SNS political party, along with his son, severely injured a police officer in Sajkas. This incident occurred when the officer attempted to break up a fight between the municipal official and another man. The police officer was punched multiple times in the head.",0,"crowd size=2",1737435626,1201,3820,4241,3820
SRB3541,"06 January 2025",2025,1,Demonstrations,Protests,"Peaceful protest","Protesters (Serbia)","Students (Serbia)",Protesters,,,,"Protesters only",,688,Europe,Serbia,Belgrade,Vracar,,"Belgrade - Vracar",44.7981,20.4772,1,FoNet,National,"On 6 January 2025, students gathered in front of the Electrotechnical Faculty in Belgrade - Vracar as part of the 'Serbia, Stop' campaign. This movement has been taking place throughout the country since November 22, encouraging participants to pause their activities and block roads for 15 minutes to honor the 15 victims of the Novi Sad tragedy and demand accountability for their loss of life.",0,"crowd size=no report",1737435626,9003,35358,61808,9003
SRB3542,"06 January 2025",2025,1,Demonstrations,Protests,"Peaceful protest","Protesters (Serbia)","Students (Serbia)",Protesters,,,,"Protesters only",,688,Europe,Serbia,Jablanica,Vlasotince,,Vlasotince,42.9669,22.134,1,"Juzne Vesti",National,"On 6 January 2025, around 300 citizens and students gathered in Vlasotince to show their support for students who have been occupying their faculties nationwide, demanding accountability for the loss of 15 lives following the collapse of a concrete canopy at the train station in Novi Sad, ultimately blaming corruption for this tragic event. The protesters observed 15 minutes of silence as part of the 'Serbia, Stop' campaign, with an aim to honor the 15 victims and voice their demands.",0,"crowd size=around 300",1737435626,2649,11265,19791,2649
SRB3536,"05 January 2025",2025,1,Demonstrations,Protests,"Peaceful protest","Protesters (Serbia)","Students (Serbia)",Protesters,,,,"Protesters only",,688,Europe,Serbia,Belgrade,Vracar,,"Belgrade - Vracar",44.7981,20.4772,1,Danas,Regional,"On 5 January 2025, students gathered in front of the Electrotechnical Faculty in Belgrade - Vracar as part of the 'Serbia, Stop' campaign. This movement has been taking place throughout the country since November 22, encouraging participants to pause their activities and block roads for 15 minutes to honor the 15 victims of the Novi Sad tragedy and demand accountability for their loss of life.",0,"crowd size=no report",1737435626,9003,35358,61808,9003
SRB3537,"05 January 2025",2025,1,Demonstrations,Protests,"Peaceful protest","Protesters (Serbia)",,Protesters,,,,"Protesters only",,688,Europe,Serbia,Rasina,Brus,,Brus,43.3845,21.0288,1,Danas,Regional,"On 5 January 2025, citizens gathered in Brus to show their support for students who have been occupying their faculties nationwide, demanding accountability for the loss of 15 lives following the collapse of a concrete canopy at the train station in Novi Sad, ultimately blaming corruption for this tragic event.",0,"crowd size=no report",1737435626,2075,4975,8071,2075
SRB3538,"05 January 2025",2025,1,Demonstrations,Protests,"Peaceful protest","Protesters (Serbia)","Students (Serbia); Teachers (Serbia)",Protesters,,,,"Protesters only",,688,Europe,Serbia,Moravica,Ivanjica,,Ivanjica,43.5802,20.2311,1,"N1TV Online - Serbia",National,"On 5 January 2025, more than 1000 citizens, along with students and teachers, gathered in Ivanjica to show their support for students who have been occupying their faculties nationwide, demanding accountability for the loss of 15 lives following the collapse of a concrete canopy at the train station in Novi Sad, ultimately blaming corruption for this tragic event. The protesters began by observing 15 minutes of silence as part of the 'Serbia, Stop' campaign, with an aim to honor the 15 victims and voice their demands.",0,"crowd size=more than 1000",1737435626,5113,12492,22222,5113
SRB3539,"05 January 2025",2025,1,Demonstrations,Protests,"Peaceful protest","Protesters (Serbia)","Students (Serbia)",Protesters,,,,"Protesters only",,688,Europe,Serbia,Branicevo,Pozarevac,,Pozarevac,44.6222,21.1826,1,Danas,Regional,"On 5 January 2025, citizens and high school students gathered in Pozarevac to show their support for students who have been occupying their faculties nationwide, demanding accountability for the loss of 15 lives following the collapse of a concrete canopy at the train station in Novi Sad, ultimately blaming corruption for this tragic event. The protesters observed 15 minutes of silence as part of the 'Serbia, Stop' campaign, with an aim to honor the 15 victims and voice their demands.",0,"crowd size=no report",1737435626,4197,14701,31008,4197
SRB3540,"05 January 2025",2025,1,Demonstrations,Protests,"Peaceful protest","Protesters (Serbia)",,Protesters,,,,"Protesters only",,688,Europe,Serbia,Pcinja,Surdulica,,Surdulica,42.6905,22.1708,1,"Danas; Juzne Vesti",National-Regional,"On 5 January 2025, around 170 citizens (according to the Archive of Public Gatherings) gathered in Surdulica to show their support for students who have been occupying their faculties nationwide, demanding accountability for the loss of 15 lives following the collapse of a concrete canopy at the train station in Novi Sad, ultimately blaming corruption for this tragic event. The protesters observed 15 minutes of silence as part of the 'Serbia, Stop' campaign, with an aim to honor the 15 victims and voice their demands.",0,"crowd size=around 170",1737435626,3929,9040,14900,3929
SRB3670,"03 January 2025",2025,1,Demonstrations,Protests,"Peaceful protest","Protesters (Serbia)",,Protesters,,,,"Protesters only",,688,Europe,Serbia,Rasina,Aleksandrovac,,Aleksandrovac,43.4586,21.0525,1,"N1TV Online - Serbia",National,"On 3 January 2025, citizens gathered in Aleksandrovac to participate in a modified version of the 'Serbia, Stop' campaign, this time not only honoring the 15 victims of the Novi Sad tragedy, but also two people who were killed on December 31 in Arilje, and 12 people who fell victims of a mass shooting on January 1 in Cetinje. The aim of the campaign is to demand accountability for their loss of life.",0,"crowd size=no report",1737435627,2999,6704,12210,2999
SRB3671,"03 January 2025",2025,1,Demonstrations,Protests,"Peaceful protest","Protesters (Serbia)","Students (Serbia)",Protesters,,,,"Protesters only",,688,Europe,Serbia,Belgrade,,,Belgrade,44.6916,20.4261,1,"FoNet; N1TV Online - Serbia",National,"On 3 January 2025, citizens and students gathered at various locations in Belgrade to participate in a modified version of the 'Serbia, Stop' campaign, this time not only honoring the 15 victims of the Novi Sad tragedy, but also two people who were killed on December 31 in Arilje, and 12 people who fell victims of a mass shooting on January 1 in Cetinje. The aim of the campaign is to demand accountability for their loss of life. The action that took place in front of the Radio and Television of Serbia (RTS) building in Takovska Street was organized by activists from the initiative 'The Bridge Stays' ('Most ostaje').",0,"crowd size=no report",1737435627,1777,13861,33117,1777
SRB3672,"03 January 2025",2025,1,Demonstrations,Protests,"Peaceful protest","Protesters (Serbia)","Farmers (Serbia)",Protesters,,,,"Protesters only",,688,Europe,Serbia,Macva,Bogatic,,Bogatic,44.8375,19.4805,1,"N1TV Online - Serbia",National,"On 3 January 2025, farmers, organized by the Association 'Our Milk - Macva' ('Nase mleko - Macva'), protested in front of the Police Station in Bogatic demanding the release of fellow farmers who had been detained and faced criminal charges for participating in a protest in Badovinci on December 29.",0,"crowd size=no report",1737435627,1784,3208,5780,1784
SRB3673,"03 January 2025",2025,1,Demonstrations,Protests,"Peaceful protest","Protesters (Serbia)",,Protesters,,,,"Protesters only",,688,Europe,Serbia,"South Banat",Kovin,,Kovin,44.7475,20.9761,1,"N1TV Online - Serbia",National,"On 3 January 2025, citizens gathered in Kovin to participate in a modified version of the 'Serbia, Stop' campaign, this time not only honoring the 15 victims of the Novi Sad tragedy, but also two people who were killed on December 31 in Arilje, and 12 people who fell victims of a mass shooting on January 1 in Cetinje. The aim of the campaign is to demand accountability for their loss of life.",0,"crowd size=no report",1737435627,4984,11342,15950,4984
SRB3675,"03 January 2025",2025,1,Demonstrations,Protests,"Peaceful protest","Protesters (Serbia)","Students (Serbia)",Protesters,,,,"Protesters only",,688,Europe,Serbia,Nisava,Nis-Medijana,,Nis,43.3234,21.9018,1,"BETA; Juzne Vesti; N1TV Online - Serbia",Subnational-National,"On 3 January 2025, several tens of citizens, students, activists, and opposition members gathered in Nis to participate in a modified version of the 'Serbia, Stop' campaign, this time not only honoring the 15 victims of the Novi Sad tragedy, but also two people who were killed on December 31 in Arilje, and 12 people who fell victims of a mass shooting on January 1 in Cetinje. The aim of the campaign is to demand accountability for their loss of life.",0,"crowd size=several tens",1737435627,5189,35833,135365,5189
SRB3676,"03 January 2025",2025,1,Demonstrations,Protests,"Peaceful protest","Protesters (Serbia)",,Protesters,,,,"Protesters only",,688,Europe,Serbia,Raska,"Novi Pazar",,"Novi Pazar",43.1375,20.5149,1,"N1TV Online - Serbia",National,"On 3 January 2025, around 30 citizens gathered in Novi Pazar to participate in a modified version of the 'Serbia, Stop' campaign, this time not only honoring the 15 victims of the Novi Sad tragedy, but also two people who were killed on December 31 in Arilje, and 12 people who fell victims of a mass shooting on January 1 in Cetinje. The aim of the campaign is to demand accountability for their loss of life.",0,"crowd size=around 30",1737435627,22703,36037,104644,22703
SRB3677,"03 January 2025",2025,1,Demonstrations,Protests,"Peaceful protest","Protesters (Serbia)","Students (Serbia); Teachers (Serbia)",Protesters,,,,"Protesters only",,688,Europe,Serbia,Nisava,Svrljig,,Svrljig,43.4133,22.1211,1,"Juzne Vesti",Subnational,"On 3 January 2025, citizens, students, teachers, and activists gathered in Svrljig to participate in the 'Serbia, Stop' campaign, honoring the 15 victims who lost their lives following the collapse of a concrete canopy at the Novi Sad's train station. The aim of the campaign is to demand accountability for their loss of life, and support demands of students who have been occupying faculties across the country.",0,"crowd size=no report",1737435627,5811,7684,10702,5811
SRB3678,"03 January 2025",2025,1,Demonstrations,Protests,"Peaceful protest","Protesters (Serbia)",,Protesters,,,,"Protesters only",,688,Europe,Serbia,Jablanica,Vlasotince,,Vlasotince,42.9669,22.134,1,"Juzne Vesti; N1TV Online - Serbia",National,"On 3 January 2025, a few citizens gathered in Vlasotince to participate in the 'Serbia, Stop' campaign, honoring the 15 victims who lost their lives following the collapse of a concrete canopy at the Novi Sad's train station. The aim of the campaign is to demand accountability for their loss of life, and support demands of students who have been occupying faculties across the country.",0,"crowd size=a few",1737435627,2649,11265,19791,2649
SRB3679,"03 January 2025",2025,1,Demonstrations,Protests,"Peaceful protest","Protesters (Serbia)",,Protesters,,,,"Protesters only",,688,Europe,Serbia,"Central Banat",Zrenjanin,,Zrenjanin,45.3818,20.3954,1,"N1TV Online - Serbia",National,"On 3 January 2025, citizens gathered in Zrenjanin to participate in a modified version of the 'Serbia, Stop' campaign, this time not only honoring the 15 victims of the Novi Sad tragedy, but also two people who were killed on December 31 in Arilje, and 12 people who fell victims of a mass shooting on January 1 in Cetinje. The aim of the campaign is to demand accountability for their loss of life.",0,"crowd size=no report",1737435627,3896,22019,71949,3896
SRB3685,"03 January 2025",2025,1,Demonstrations,Protests,"Protest with intervention","Protesters (Serbia)","Students (Serbia)",Protesters,"Rioters (Serbia)","Police Forces of Serbia (2017-)",Rioters,Rioters-Protesters,,688,Europe,Serbia,"South Backa","Novi Sad",,"Novi Sad",45.2593,19.8291,1,"FoNet; N1TV Online - Serbia",National,"On 3 January 2025, citizens gathered at various locations in Novi Sad to participate in a modified version of the 'Serbia, Stop' campaign, this time not only honoring the 15 victims of the Novi Sad tragedy, but also two people who were killed on December 31 in Arilje, and 12 people who fell victims of a mass shooting on January 1 in Cetinje. The aim of the campaign is to demand accountability for their loss of life. At the city's quay, a driver attempted to go through the crowd. To stop him, a man used a pepper spray, and the police arrested the man who had sprayed the driver. In response, students who witnessed the incident gathered in front of the police station, demanding his release. They also demanded to provide statements to the police, explaining that the man was trying to protect them.",0,"crowd size=no report",1737435627,9541,41595,169916,9541
SRB3674,"03 January 2025",2025,1,Demonstrations,Protests,"Peaceful protest","Protesters (Serbia)","Former Military Forces of Serbia (2017-)",Protesters,,,,"Protesters only",,688,Europe,Serbia,Raska,Kraljevo,,Kraljevo,43.7259,20.6896,1,"N1TV Online - Serbia",National,"On 3 January 2025, citizens along with veterans of the 63rd Parachute Brigade gathered in Kraljevo to participate in a modified version of the 'Serbia, Stop' campaign, this time not only honoring the 15 victims of the Novi Sad tragedy, but also two people who were killed on December 31 in Arilje, and 12 people who fell victims of a mass shooting on January 1 in Cetinje. The aim of the campaign is to demand accountability for their loss of life.",0,"crowd size=no report",1738712872,5532,21674,46623,5532
SRB3669,"02 January 2025",2025,1,Demonstrations,Protests,"Peaceful protest","Protesters (Serbia)","Students (Serbia)",Protesters,,,,"Protesters only",,688,Europe,Serbia,Belgrade,Vracar,,"Belgrade - Vracar",44.7981,20.4772,1,"N1TV Online - Serbia",National,"On 2 January 2025, several hundred students and citizens gathered in front of the Electrotechnical Faculty in Belgrade - Vracar to participate in a modified version of the 'Serbia, Stop' campaign. Instead of pausing their activities for 15 minutes to honor the 15 victims of the Novi Sad tragedy following a collapse of a concrete canopy at the city's train station, they observed 29 minutes of silence, to also honor two people who were killed on December 31 in Arilje, and 12 people who fell victims of a mass shooting on January 1 in Cetinje. The aim of the campaign is to demand accountability for their loss of life.",0,"crowd size=several hundred",1737435627,9003,35358,61808,9003
SRB3665,"31 December 2024",2024,1,Demonstrations,Protests,"Peaceful protest","Protesters (Serbia)","Students (Serbia)",Protesters,,,,"Protesters only",,688,Europe,Serbia,Belgrade,"Stari Grad",,"Belgrade - Stari Grad",44.823,20.4605,1,"Danas; N1TV Online - Serbia",National-Regional,"On 31 December 2024, between 17.000 and 18.000 citizens and students (according to the Archive of Public Gathering) gathered near the Republic Square in Belgrade - Stari Grad to observe 15 minutes of silence just before midnight, as part of the 'Serbia, Stop' campaign. With this action, protesters wanted to honor the 15 victims who lost their lives when the concrete canopy collapsed at the Novi Sad train station, and call for accountability regarding this tragedy. Similar actions on New Year's Eve were held in two other cities, Novi Sad and Nis. Currently, over 50 faculties across four universities are closed and occupied by students. Their demands include the publication of documents related to the reconstruction of the Novi Sad railway station, the release and dismissal of charges against those arrested during protests, criminal charges against individuals who attacked students during these protests, and a 20% increase in funding for state universities.",0,"crowd size=between 17.000 and 18.000",1737435627,9651,38334,101955,9651
SRB3666,"31 December 2024",2024,1,Demonstrations,Protests,"Peaceful protest","Protesters (Serbia)","Students (Serbia)",Protesters,,,,"Protesters only",,688,Europe,Serbia,Sumadija,Kragujevac,,Kragujevac,44.0109,20.909,1,Danas,Regional,"On 31 December 2024, citizens and students gathered in Kragujevac to observe 16 minutes of silence just before midnight, as part of the 'Serbia, Stop' campaign. With this action, protesters wanted to call for accountability and honor the 15 victims who lost their lives when the concrete canopy collapsed at the Novi Sad train station, but also to honor a victim from school shooting in Croatia. Currently, over 50 faculties across four universities are closed and occupied by students. Their demands include the publication of documents related to the reconstruction of the Novi Sad railway station, the release and dismissal of charges against those arrested during protests, criminal charges against individuals who attacked students during these protests, and a 20% increase in funding for state universities.",0,"crowd size=no report",1737435627,13095,22794,115608,13095
